{
  "schemaVersion": "1.0",
  "runId": "weekly_fixture_001",
  "scheduledFor": "2026-07-26T02:00:00+08:00",
  "state": "PLANNED",
  "plannedActions": [
    "FLUSH_CHANGED_CASES",
    "REFRESH_PROJECTIONS",
    "ROLLOVER_CLOSED_CASES",
    "UPDATE_ARCHIVE_INDEX"
  ],
  "dryRun": true,
  "createdAt": "2026-07-23T10:00:00+08:00",
  "completedAt": null,
  "estimatedWrites": 3
}
